{
  "athleteId": "50372834",
  "name": "Jordan Superior",
  "gender": "NB",
  "activityUrl": "https://www.strava.com/activities/12295793945",
  "submittedAt": "2026-06-07T15:18:00Z",
  "segments": {
    "6809754": {
      "elapsed_time": 1704
    },
    "16438243": {
      "elapsed_time": 1079
    },
    "24479270": {
      "elapsed_time": 567
    },
    "24479292": {
      "elapsed_time": 1725
    },
    "24479426": {
      "elapsed_time": 1996
    },
    "24479467": {
      "elapsed_time": 1408
    },
    "24479496": {
      "elapsed_time": 2302
    },
    "34573011": {
      "elapsed_time": 1736
    },
    "41126651": {
      "elapsed_time": 631
    }
  }
}
