{
  "athleteId": "55198933",
  "name": "Josh Maki",
  "gender": "M",
  "activityUrl": "https://www.strava.com/activities/12875098735",
  "submittedAt": "2026-06-07T16:45:00Z",
  "segments": {
    "6809754": {
      "elapsed_time": 1886
    },
    "16438243": {
      "elapsed_time": 1169
    },
    "24479270": {
      "elapsed_time": 659
    },
    "24479292": {
      "elapsed_time": 2145
    },
    "24479426": {
      "elapsed_time": 2584
    },
    "24479467": {
      "elapsed_time": 1653
    },
    "24479496": {
      "elapsed_time": 2942
    },
    "34573011": {
      "elapsed_time": 2068
    },
    "41126651": {
      "elapsed_time": 742
    }
  }
}
