{
  "athleteId": "87531056",
  "name": "Tyler Krueger",
  "gender": "M",
  "activityUrl": "https://www.strava.com/activities/12739350882",
  "submittedAt": "2026-06-07T15:56:00Z",
  "segments": {
    "6809754": {
      "elapsed_time": 1537
    },
    "16438243": {
      "elapsed_time": 937
    },
    "24479270": {
      "elapsed_time": 500
    },
    "24479292": {
      "elapsed_time": 1574
    },
    "24479426": {
      "elapsed_time": 1738
    },
    "24479467": {
      "elapsed_time": 1169
    },
    "24479496": {
      "elapsed_time": 2326
    },
    "34573011": {
      "elapsed_time": 1766
    },
    "41126651": {
      "elapsed_time": 588
    }
  }
}
