{
  "athleteId": "test-pipeline-01",
  "name": "Test Pipeline",
  "gender": "M",
  "activityUrl": "https://www.strava.com/activities/99999999",
  "submittedAt": "2026-03-31T16:25:42.000Z",
  "segments": {
    "24479292": {
      "elapsed_time": 1500
    },
    "24479426": {
      "elapsed_time": 1800
    },
    "24479467": {
      "elapsed_time": 1200
    },
    "24479496": {
      "elapsed_time": 2100
    },
    "34573011": {
      "elapsed_time": 1500
    },
    "6809754": {
      "elapsed_time": 1400
    },
    "24479270": {
      "elapsed_time": 480
    },
    "41126651": {
      "elapsed_time": 650
    },
    "16438243": {
      "elapsed_time": 900
    }
  }
}
