{
  "athleteId": "57085406",
  "name": "Rachel Ishpeming",
  "gender": "F",
  "activityUrl": "https://www.strava.com/activities/12007642289",
  "submittedAt": "2026-06-07T17:41:00Z",
  "segments": {
    "6809754": {
      "elapsed_time": 1759
    },
    "16438243": {
      "elapsed_time": 1095
    },
    "24479270": {
      "elapsed_time": 611
    },
    "24479292": {
      "elapsed_time": 1873
    },
    "24479426": {
      "elapsed_time": 2224
    },
    "24479467": {
      "elapsed_time": 1388
    },
    "24479496": {
      "elapsed_time": 2642
    },
    "34573011": {
      "elapsed_time": 2061
    },
    "41126651": {
      "elapsed_time": 681
    }
  }
}
