{
  "athleteId": "2262684",
  "name": "jamison sheppard",
  "gender": "M",
  "activityUrl": "https://www.strava.com/activities/11559430093",
  "submittedAt": "2026-03-31T19:29:05.121Z",
  "segments": {
    "16438243": {
      "elapsed_time": 422
    },
    "24479270": {
      "elapsed_time": 246
    },
    "24479292": {
      "elapsed_time": 1218
    },
    "24479426": {
      "elapsed_time": 369
    },
    "24479467": {
      "elapsed_time": 389
    },
    "24479496": {
      "elapsed_time": 1214
    },
    "34573011": {
      "elapsed_time": 1109
    },
    "41126651": {
      "elapsed_time": 78
    }
  }
}
