{
  "athleteId": "92909954",
  "name": "Casey Pictured",
  "gender": "NB",
  "activityUrl": "https://www.strava.com/activities/12773882647",
  "submittedAt": "2026-06-07T15:15:00Z",
  "segments": {
    "6809754": {
      "elapsed_time": 1885
    },
    "16438243": {
      "elapsed_time": 1065
    },
    "24479270": {
      "elapsed_time": 563
    },
    "24479292": {
      "elapsed_time": 1993
    },
    "24479426": {
      "elapsed_time": 2266
    },
    "24479467": {
      "elapsed_time": 1410
    },
    "24479496": {
      "elapsed_time": 2781
    },
    "41126651": {
      "elapsed_time": 784
    }
  }
}
