{
  "athleteId": "13445487",
  "name": "Luke Ojibway",
  "gender": "M",
  "activityUrl": "https://www.strava.com/activities/12664750346",
  "submittedAt": "2026-06-07T18:54:00Z",
  "segments": {
    "16438243": {
      "elapsed_time": 1138
    },
    "24479270": {
      "elapsed_time": 679
    },
    "24479292": {
      "elapsed_time": 2075
    },
    "24479426": {
      "elapsed_time": 2383
    },
    "24479467": {
      "elapsed_time": 1678
    },
    "24479496": {
      "elapsed_time": 2947
    },
    "34573011": {
      "elapsed_time": 2175
    },
    "41126651": {
      "elapsed_time": 821
    }
  }
}
