{
  "athleteId": "81420615",
  "name": "Alex Keweenaw",
  "gender": "NB",
  "activityUrl": "https://www.strava.com/activities/12232377760",
  "submittedAt": "2026-06-07T14:50:00Z",
  "segments": {
    "6809754": {
      "elapsed_time": 1508
    },
    "16438243": {
      "elapsed_time": 846
    },
    "24479270": {
      "elapsed_time": 472
    },
    "24479292": {
      "elapsed_time": 1544
    },
    "24479426": {
      "elapsed_time": 1721
    },
    "24479467": {
      "elapsed_time": 1148
    },
    "24479496": {
      "elapsed_time": 1963
    },
    "34573011": {
      "elapsed_time": 1681
    },
    "41126651": {
      "elapsed_time": 594
    }
  }
}
