{
  "athleteId": "49366680",
  "name": "Katie Munising",
  "gender": "F",
  "activityUrl": "https://www.strava.com/activities/12130384179",
  "submittedAt": "2026-06-07T17:55:00Z",
  "segments": {
    "6809754": {
      "elapsed_time": 1798
    },
    "16438243": {
      "elapsed_time": 1125
    },
    "24479270": {
      "elapsed_time": 610
    },
    "24479292": {
      "elapsed_time": 1741
    },
    "24479426": {
      "elapsed_time": 2368
    },
    "24479467": {
      "elapsed_time": 1435
    },
    "24479496": {
      "elapsed_time": 2577
    },
    "34573011": {
      "elapsed_time": 2152
    },
    "41126651": {
      "elapsed_time": 704
    }
  }
}
