{
  "athleteId": "30457050",
  "name": "Dan Virtanen",
  "gender": "M",
  "activityUrl": "https://www.strava.com/activities/12383366401",
  "submittedAt": "2026-06-07T17:59:00Z",
  "segments": {
    "6809754": {
      "elapsed_time": 1654
    },
    "16438243": {
      "elapsed_time": 1087
    },
    "24479270": {
      "elapsed_time": 544
    },
    "24479292": {
      "elapsed_time": 1856
    },
    "24479426": {
      "elapsed_time": 2292
    },
    "24479467": {
      "elapsed_time": 1513
    },
    "24479496": {
      "elapsed_time": 2599
    },
    "34573011": {
      "elapsed_time": 2024
    },
    "41126651": {
      "elapsed_time": 677
    }
  }
}
