{
  "athleteId": "23815810",
  "name": "Jess Baraga",
  "gender": "F",
  "activityUrl": "https://www.strava.com/activities/12837443443",
  "submittedAt": "2026-06-07T14:40:00Z",
  "segments": {
    "6809754": {
      "elapsed_time": 1903
    },
    "16438243": {
      "elapsed_time": 1237
    },
    "24479270": {
      "elapsed_time": 661
    },
    "24479292": {
      "elapsed_time": 2049
    },
    "24479426": {
      "elapsed_time": 2515
    },
    "24479467": {
      "elapsed_time": 1627
    },
    "24479496": {
      "elapsed_time": 2564
    },
    "34573011": {
      "elapsed_time": 1988
    },
    "41126651": {
      "elapsed_time": 827
    }
  }
}
