{
  "athleteId": "97732836",
  "name": "Anna Lakefield",
  "gender": "F",
  "activityUrl": "https://www.strava.com/activities/12249743632",
  "submittedAt": "2026-06-07T18:35:00Z",
  "segments": {
    "6809754": {
      "elapsed_time": 1642
    },
    "16438243": {
      "elapsed_time": 1015
    },
    "24479270": {
      "elapsed_time": 560
    },
    "24479292": {
      "elapsed_time": 1695
    },
    "24479426": {
      "elapsed_time": 2011
    },
    "24479467": {
      "elapsed_time": 1291
    },
    "24479496": {
      "elapsed_time": 2384
    },
    "34573011": {
      "elapsed_time": 1698
    },
    "41126651": {
      "elapsed_time": 666
    }
  }
}
