{
  "athleteId": "65952359",
  "name": "Lauren Houghton",
  "gender": "F",
  "activityUrl": "https://www.strava.com/activities/12125025158",
  "submittedAt": "2026-06-07T14:25:00Z",
  "segments": {
    "6809754": {
      "elapsed_time": 1976
    },
    "16438243": {
      "elapsed_time": 1234
    },
    "24479270": {
      "elapsed_time": 621
    },
    "24479292": {
      "elapsed_time": 2050
    },
    "24479467": {
      "elapsed_time": 1688
    },
    "24479496": {
      "elapsed_time": 2952
    },
    "34573011": {
      "elapsed_time": 2141
    },
    "41126651": {
      "elapsed_time": 810
    }
  }
}
