{
  "athleteId": "11717627",
  "name": "Chris Saarinen",
  "gender": "M",
  "activityUrl": "https://www.strava.com/activities/12092675458",
  "submittedAt": "2026-06-07T14:58:00Z",
  "segments": {
    "6809754": {
      "elapsed_time": 1681
    },
    "16438243": {
      "elapsed_time": 990
    },
    "24479270": {
      "elapsed_time": 551
    },
    "24479292": {
      "elapsed_time": 1640
    },
    "24479426": {
      "elapsed_time": 1986
    },
    "24479467": {
      "elapsed_time": 1443
    },
    "24479496": {
      "elapsed_time": 2554
    },
    "34573011": {
      "elapsed_time": 1724
    },
    "41126651": {
      "elapsed_time": 662
    }
  }
}
