{
  "athleteId": "58323178",
  "name": "Sarah Marquette",
  "gender": "F",
  "activityUrl": "https://www.strava.com/activities/12403263216",
  "submittedAt": "2026-06-07T14:56:00Z",
  "segments": {
    "6809754": {
      "elapsed_time": 1410
    },
    "16438243": {
      "elapsed_time": 936
    },
    "24479270": {
      "elapsed_time": 489
    },
    "24479292": {
      "elapsed_time": 1619
    },
    "24479426": {
      "elapsed_time": 1939
    },
    "24479467": {
      "elapsed_time": 1223
    },
    "24479496": {
      "elapsed_time": 2196
    },
    "34573011": {
      "elapsed_time": 1486
    },
    "41126651": {
      "elapsed_time": 576
    }
  }
}
