{
  "athleteId": "27782212",
  "name": "Sam Mackinaw",
  "gender": "M",
  "activityUrl": "https://www.strava.com/activities/12497511320",
  "submittedAt": "2026-06-07T17:42:00Z",
  "segments": {
    "6809754": {
      "elapsed_time": 1815
    },
    "16438243": {
      "elapsed_time": 1095
    },
    "24479270": {
      "elapsed_time": 595
    },
    "24479292": {
      "elapsed_time": 1844
    },
    "24479426": {
      "elapsed_time": 2291
    },
    "24479467": {
      "elapsed_time": 1463
    },
    "24479496": {
      "elapsed_time": 2619
    },
    "34573011": {
      "elapsed_time": 1869
    },
    "41126651": {
      "elapsed_time": 757
    }
  }
}
