{
  "athleteId": "32711065",
  "name": "Jake Morrison",
  "gender": "M",
  "activityUrl": "https://www.strava.com/activities/12577800851",
  "submittedAt": "2026-06-07T19:29:00Z",
  "segments": {
    "6809754": {
      "elapsed_time": 1388
    },
    "16438243": {
      "elapsed_time": 971
    },
    "24479270": {
      "elapsed_time": 451
    },
    "24479292": {
      "elapsed_time": 1401
    },
    "24479426": {
      "elapsed_time": 1822
    },
    "24479467": {
      "elapsed_time": 1147
    },
    "24479496": {
      "elapsed_time": 2058
    },
    "34573011": {
      "elapsed_time": 1479
    },
    "41126651": {
      "elapsed_time": 636
    }
  }
}
