{
  "athleteId": "23976451",
  "name": "Matt Lindberg",
  "gender": "M",
  "activityUrl": "https://www.strava.com/activities/12640228854",
  "submittedAt": "2026-06-07T17:41:00Z",
  "segments": {
    "6809754": {
      "elapsed_time": 1572
    },
    "16438243": {
      "elapsed_time": 942
    },
    "24479270": {
      "elapsed_time": 540
    },
    "24479292": {
      "elapsed_time": 1684
    },
    "24479426": {
      "elapsed_time": 1910
    },
    "24479467": {
      "elapsed_time": 1190
    },
    "24479496": {
      "elapsed_time": 2069
    },
    "34573011": {
      "elapsed_time": 1717
    },
    "41126651": {
      "elapsed_time": 659
    }
  }
}
